{
  "module_id": "led",
  "module_name": "led",
  "publisher": "do-exe",
  "interface": "gpio",
  "protocol": null,
  "version": "0.1.0",
  "modified_date": "",
  "has_variant": false,
  "variants": [],
  "summary": "Adaptive LED driver for one or many GPIO, PWM, RGB, or RGBRGB LED channels.",
  "verified": true
}
