{
  "module_id": "pwm_led",
  "module_name": "pwm_led",
  "publisher": "do-exe",
  "interface": "gpio",
  "protocol": null,
  "version": "0.1.0",
  "modified_date": "",
  "has_variant": false,
  "variants": [],
  "summary": "Single LED channel controlled with PWM brightness on one GPIO pin.",
  "verified": true
}
